{
  "id": "lumbar_strain_no_red_flags",
  "label": "Lumbar strain without red flags",
  "status": "draft",
  "condition_family": "musculoskeletal_back_pain",
  "inclusion_criteria": [
    "Adult with acute mechanical low back pain or lumbar strain.",
    "No trauma requiring spine imaging or immobilization.",
    "No fever or systemic infectious concern.",
    "No new weakness, saddle anesthesia, urinary retention, bowel incontinence, or other cauda equina concern.",
    "Able to ambulate or safely mobilize at discharge."
  ],
  "exclusion_criteria": [
    "Major trauma or suspected fracture.",
    "Known cancer with concerning back pain.",
    "Intravenous drug use with fever or spinal infection concern.",
    "New neurologic deficit.",
    "Pregnancy-specific back pain pathway.",
    "Post-procedure or post-operative spine patient."
  ],
  "must_not_miss": [
    "Cauda equina syndrome.",
    "Spinal epidural abscess.",
    "Vertebral fracture.",
    "Aortic emergency when symptoms are atypical.",
    "Renal colic, pyelonephritis, or other non-MSK mimic."
  ],
  "default_follow_up": "Primary care follow-up in 1 to 2 weeks if not improving.",
  "required_sections": [
    "diagnosis",
    "what_we_found",
    "home_care",
    "medications",
    "return_precautions",
    "follow_up"
  ],
  "primitive_ids": [
    "back_pain.diagnosis.lumbar_strain.v1",
    "back_pain.what_we_found.reassuring_exam.v1",
    "back_pain.home_care.activity.v1",
    "back_pain.home_care.lifting.v1",
    "back_pain.home_care.ice_heat.v1",
    "back_pain.home_care.sleep_sitting.v1",
    "back_pain.medications.acetaminophen.v1",
    "back_pain.medications.nsaid_caution.v1",
    "back_pain.return_precautions.cauda_equina.v1",
    "back_pain.return_precautions.neuro_fever_trauma.v1",
    "back_pain.follow_up.primary_care.v1"
  ],
  "source_card_ids": [
    "medlineplus.low_back_pain_acute",
    "wikem.low_back_pain"
  ],
  "review": {
    "status": "draft",
    "reviewer": null,
    "last_reviewed": null,
    "notes": "First ontology slice. Needs EM clinician review before production use."
  }
}
